发布日期,平台,标题,标签,一句话描述,推荐度,推荐标签,判断理由,链接,用户备注
2026-06-03,PC,百日战纪 最终防卫学园,ADV；SRPG；小高和刚；打越钢太郎；多结局；叙事驱动；防卫战,小高和刚与打越钢太郎联手打造的ADV+SRPG新作。15名学生被召集至最终防卫学园，必须在100天内抵御侵校生入侵。多重结局由你的选择决定，包含防卫战SRPG和自由探索环节。,4,推荐,小高和刚（弹丸论破）与打越钢太郎（极限脱出）强强联手，叙事驱动、多重结局、选择导向，高度贴合你的口味。,https://www.gamer520.com/91819.html,否，传统战棋
2026-06-03,PC,钢铁之种 Steel Seed,动作；潜行；科幻；战斗,在后末日世界中进行潜行和战斗，探索废墟并揭开灾难背后的真相。,1,非常不推荐,核心是动作潜行战斗，不符合你的偏好。,https://www.gamer520.com/91725.html,
2026-06-03,PC,勇闯死人谷 暗黑之日,丧尸；射击；生存；动作；跑酷,在丧尸末日中狂奔穿梭，通过跑酷和射击在尸潮中生存并寻找安全出路。,1,非常不推荐,核心是丧尸射击和跑酷动作，不符合你的偏好。,https://www.gamer520.com/91135.html,
2026-06-03,Switch,蝙蝠侠 阿卡姆骑士 Batman Arkham Knight,动作；超级英雄；战斗；潜行；开放世界,扮演蝙蝠侠在高谭市打击犯罪，运用格斗技巧和潜行击败哥谭的犯罪势力。,1,非常不推荐,核心是高强度动作格斗和潜行战斗，不符合你的偏好。,https://www.gamer520.com/68691.html,
2026-06-03,Switch,西瓜游戏 合成大西瓜,休闲；益智；物理；堆叠；解压,将水果投入容器中，让相同水果碰撞合成更大的水果，最终合成大西瓜的休闲物理益智游戏。,1,非常不推荐,核心是休闲物理益智，缺乏叙事和策略深度，不符合你的偏好。,https://www.gamer520.com/66897.html,
2026-06-03,PC,僵尸毁灭工程 Project Zomboid,丧尸；生存；沙盒；硬核；资源管理,在丧尸末日的硬核沙盒中求生存，管理饥饿、健康、情绪和资源，面对一场无法获胜的持久战。,2,不推荐,沙盒生存和资源压力有研究价值，但硬核生存循环和缺乏叙事目标偏离你的核心口味。,https://www.gamer520.com/43904.html,
2026-06-03,PC,夜族崛起 V Rising,吸血鬼；生存；建造；开放世界；战斗,扮演苏醒的吸血鬼，建造城堡、狩猎鲜血、征服领地，在开放世界中崛起。,2,不推荐,吸血鬼题材和城堡建设有氛围，但核心是生存建造和开放世界战斗循环，叙事密度有限。,https://www.gamer520.com/32134.html,
2026-06-03,PC,帝国时代 IV Age of Empires IV,RTS；历史；策略；战役；即时战斗,在历史长河中指挥帝国军队，通过资源采集、基地建设和战斗推进从黑暗时代到文艺复兴的文明征程。,1,非常不推荐,核心是即时战略战斗和资源管理，与你明确不喜欢的类型高度重合。,https://www.gamer520.com/23904.html,
2026-06-02,Switch,卡片战斗先导者DD2 Cardfight Vanguard DD2,卡牌对战；TCG；策略；动漫改编,基于人气TCG的卡牌对战游戏，构筑卡组并与其他角色对决。,1,非常不推荐,核心是卡牌对战和构筑，不符合你的偏好。,https://www.gamer520.com/114701.html,
2026-06-02,PC,飞空艇探险物语,冒险；模拟经营；空艇；探索；角色扮演,驾驶飞艇探索天空岛屿、招募船员、执行任务并发展飞艇设施，在冒险中揭开天空尽头的秘密。,2,不推荐,有探索和角色扮演元素，但核心是模拟经营和任务循环，叙事密度可能有限。,https://www.gamer520.com/114677.html,
2026-06-02,PC,眷族,宠物收集；战斗；进化；培养；冒险,捕捉和培养大量宠物进行战斗，通过进化、变异和技能搭配打造独特队伍，探索随机生成的冒险世界。,1,非常不推荐,核心是宠物收集培养和战斗循环，与你明确不喜欢的元素高度重合。,https://www.gamer520.com/114675.html,
2026-06-02,PC,破碎怪谈：恶意关注,恐怖；心理惊悚；解谜；逃亡；叙事,扮演安妮在充满超现实怪物的内心世界中探索记忆、解谜并躲避追杀，揭开她与母亲关系的黑暗真相。,2,不推荐,恐怖氛围和心理叙事有一定牵引力，但核心是逃亡躲藏和解谜，体验偏惊吓。,https://www.gamer520.com/114673.html,
2026-06-02,PC,仙之气,修仙；动作；江湖；战斗；仙侠,在仙侠世界中修炼功法、闯荡江湖、击败强敌以飞升成仙。,1,非常不推荐,核心是修仙动作战斗，属于你明确不喜欢的类型。,https://www.gamer520.com/114086.html,
2026-06-02,PC,潘多拉的玩具盒,上帝模拟；沙盒；文明建设；策略；Roguelite,化身埃庇米修斯在随机生成的像素大陆上创造并引导人类文明发展，从聚落到城邦，抵御异教徒并传播信仰。,2,不推荐,有策略和文明建设的趣味，但核心是上帝模拟沙盒和Roguelite循环，缺乏叙事引导。,https://www.gamer520.com/113814.html,
2026-06-02,PC,佩布尔骑士 Pebble Knight,动作；平台跳跃；冒险；骑士,扮演骑士在像素风格的关卡中跳跃和战斗，克服障碍完成冒险。,1,非常不推荐,核心是动作平台跳跃和战斗，不符合你的偏好。,https://www.gamer520.com/111727.html,
2026-06-02,PC,哀鸿：城破十日记,文字冒险；明末历史；叙事驱动；生存；多结局,"扮演书生方知宥误入""狮驼国""，在群妖屠城的十日内努力求生并找回记忆，解开故人死亡之谜。零创游戏剧情第三作。45万字多结局。",4,推荐,零创游戏继《饿殍》《葬花》后新作，文字叙事驱动、明末历史题材、多结局选择，高度贴合你的口味。,https://www.gamer520.com/111372.html,
2026-06-02,PC,弑神者竞技场,动作；竞技场；战斗；挑战,在竞技场中与各路敌人战斗，通过不断挑战提升实力。,1,非常不推荐,核心是动作战斗和竞技挑战，不符合你的偏好。,https://www.gamer520.com/94600.html,
2026-06-02,PC,巴别塔：混乱的幸存者,生存动作；Roguelite；幸存者类；战斗,在巴别塔的混乱环境中面对一波波敌人，通过升级和Build构筑生存下去。,1,非常不推荐,核心是幸存者类动作生存刷局，与你明确不喜欢的元素高度重合。,https://www.gamer520.com/93085.html,
2026-06-02,PC,汽水侠 Sodaman,动作；平台跳跃；战斗；能量饮料,扮演汽水侠使用能量饮料赋予的超能力战斗和探索。,1,非常不推荐,核心是动作平台战斗，不符合你的偏好。,https://www.gamer520.com/88919.html,
2026-06-02,PC,星之海洋2 STAR OCEAN THE SECOND STORY R,动作RPG；JRPG；重制；战斗；太空奇幻,在太空与奇幻交织的世界中展开经典JRPG冒险，通过实时战斗和角色培养推进剧情。,1,非常不推荐,核心是动作RPG战斗和角色培养，不符合你的叙事偏好。,https://www.gamer520.com/67177.html,
2026-06-01,Switch,忍者龙剑传：西格玛1,动作；忍者；高速战斗；经典重制,扮演忍者隼龙使用各种武器和忍术高速战斗，击败敌人并追寻真相。,1,非常不推荐,核心是高强度动作和操作挑战，与你的口味完全错位。,https://www.gamer520.com/114624.html,
2026-06-01,Switch,奇迹之星 Wander Stars,回合制RPG；动漫；文字组合；太空冒险；收集,扮演武术家林戈通过组合文字释放自定义攻击，在太空冒险中收集地图碎片并寻找失踪的哥哥。,2,不推荐,动漫风格和文字组合系统有一定形式感，但核心是回合制战斗和收集循环。,https://www.gamer520.com/114618.html,
2026-06-01,Switch,魔饮心语 Tavern Talk,酒馆经营；叙事；奇幻；DND；角色互动；调配魔饮,经营阿斯忒里亚大陆的寻路者酒馆，为冒险者调配魔饮、发布任务、倾听故事并揭开威胁世界的秘密。,4,推荐,酒馆经营、人物互动、叙事任务和世界危机都有很强的吸引力，贴近你喜欢的地点经营和故事推进。,https://www.gamer520.com/114616.html,
2026-06-01,PC,墨境,动作Roguelite；水墨；高速战斗；Build构筑,在水墨风格的奇幻世界中反复闯关，通过构筑Build和高速战斗挑战层层关卡。,1,非常不推荐,核心是高速动作和重复刷局，不符合你的偏好。,https://www.gamer520.com/114304.html,
2026-06-01,PC,挂机升级打怪兽,挂机；放置；升级；打怪；数值成长,通过挂机自动战斗和升级，不断挑战更强大的怪物获取更高收益。,1,非常不推荐,核心是挂机放置和数值成长，属于你明确不喜欢的类型。,https://www.gamer520.com/113956.html,
2026-06-01,PC,绝地鸭卫,塔防；策略；可爱风格；防御,扮演鸭子守卫者，通过布置防御和策略搭配抵御敌人进攻。,2,不推荐,有策略元素但核心是塔防防守，叙事和体验核心较弱。,https://www.gamer520.com/113686.html,
2026-06-01,PC,昏迷3：血脉,2D恐怖；逃亡；韩国巫术；解谜；剧情,在阴影笼罩的昏谜世界中扮演三名主角，躲避傀儡追杀、搜集线索、揭开韩国巫术与诅咒的谜团。,3,可试,恐怖氛围、韩国民俗和解谜有叙事牵引；但核心是逃亡躲藏，体验偏惊吓和回避。,https://www.gamer520.com/112709.html,
2026-06-01,PC,OPUS：心相吾山,叙事冒险；摄影；解谜；乡愁；神话；治愈,扮演迷失在亡土的中年摄影师，与失去记忆的女孩一同旅行，透过相机破解谜团并找到回家的路。,5,优先推荐,摄影、叙事、谜团、双人陪伴和乡愁主题都高度贴合你的口味；形式感和氛围极强。,https://www.gamer520.com/111911.html,
2026-06-01,PC,遗物深渊 Relic Abyss,动作Rogue；弹幕射击；洛夫克拉夫特；探索；Build构筑,在深渊吞噬的世界中探索随机生成关卡，收集圣物和技能，用弹幕射击击败异界头目。,1,非常不推荐,核心是动作Rogue弹幕射击和重复刷局，与你明确不喜欢的元素高度重合。,https://www.gamer520.com/111763.html,
2026-06-01,PC,红色沙漠,开放世界；动作冒险；探索；战斗；龙；中世纪,化身灰鬃领袖克里夫，驰骋帕卫尔大陆、探索遗迹与阿比斯领域，在战斗、冒险与选择中拯救世界。,2,不推荐,有探索和世界氛围，但核心是开放世界动作战斗和高强度操作，偏离你的叙事偏好。,https://www.gamer520.com/110658.html,
2026-06-01,PC,万界·飞升成圣,修仙；放置；飞升；万界；境界突破,穿越万界通过修炼和战斗突破境界，最终飞升成圣。,1,非常不推荐,核心是泛修仙放置和数值成长，与你明确不喜欢的元素高度重合。,https://www.gamer520.com/110245.html,
2026-06-01,Switch,超时空方舟 Chrono Ark,卡牌构筑；Roguelike；组队RPG；策略,组建最多4人队伍，通过卡牌构筑和角色配合探索扭曲之地，收集时空之影拯救世界。,2,不推荐,有组队策略但核心是卡牌构筑和Roguelike循环，属于你通常兴趣较低的类型。,https://www.gamer520.com/105829.html,
2026-06-01,PC,蜀仙传·挂至飞升,修仙；挂机；放置；门派；飞升,在蜀山世界中通过挂机修炼、门派成长和自动战斗逐步飞升成仙。,1,非常不推荐,核心是泛修仙挂机放置，属于你明确不喜欢的类型。,https://www.gamer520.com/105244.html,
2026-06-01,Switch,普力多 普力兹纳 PRITTO PRISONER,解谜；逃脱；监狱；策略,在监狱环境中通过解谜和策略规划寻找逃脱的方法。,2,不推荐,有解谜元素但题材和叙事方向不明确。,https://www.gamer520.com/105233.html,
2026-06-01,Switch,我是未来：悠闲末日生活 I Am Future,休闲生存；末日；屋顶建设；农耕；钓鱼；探索,在洪水淹没的末世城市屋顶上打造温馨营地，种植烹任、拆解制作、雇佣机器人并揭开灾变谜团。,3,可试,舒适生存、基地建设和末日探索有生活气息；但偏建造和自动化，叙事密度可能有限。,https://www.gamer520.com/105224.html,
2026-06-01,PC,水上乐园模拟器,模拟；经营；水上乐园；建设,经营水上乐园，通过建造设施、管理运营和满足游客需求来扩展业务。,1,不推荐,核心是模拟器经营流程，缺少叙事和人物驱动。,https://www.gamer520.com/103022.html,
2026-06-01,PC,明末：欲火重生,动作RPG；明末；历史奇幻；战斗；剧情,在明末乱世中以崭新视角展开一段动作角色扮演之旅，通过战斗和剧情推进故事。,1,非常不推荐,核心是高强度动作战斗和操作挑战，不符合你的口味。,https://www.gamer520.com/102264.html,
2026-06-01,PC,魔女祇兵 Majogami,动作；魔女；奇幻；战斗；角色扮演,扮演魔女使用魔法和武器在奇幻世界中战斗和冒险。,1,非常不推荐,核心是动作战斗，缺乏叙事和体验核心。,https://www.gamer520.com/102018.html,
2026-06-01,PC,超级幻想王国,沙盒；创造；幻想；建设；探索,在幻想王国中自由建造、探索和创造自己的世界。,2,不推荐,沙盒创造自由度较高，但缺乏叙事核心和体验结构。,https://www.gamer520.com/101278.html,
2026-06-01,Switch,喧哗番长 乙女 2nd Rumble,动作；校园；乙女；打架；日式,扮演女番长在校园中通过战斗和交涉解决问题，展开一段喧哗青春故事。,1,非常不推荐,核心是动作战斗和校园打架，不符合你的偏好。,https://www.gamer520.com/95362.html,
2026-06-01,PC,万象群侠传,武侠；RPG；群侠；江湖；战斗,在广阔的武侠世界中招募群侠、修炼武功、闯荡江湖。,1,非常不推荐,核心是武侠战斗和角色成长，缺乏叙事和体验核心。,https://www.gamer520.com/88181.html,
2026-06-01,Switch,电锯甜心 重制 Lollipop Chainsaw RePOP,动作；僵尸；电锯；二次元；重制,扮演僵尸猎人朱丽叶用电锯砍杀僵尸，在校园与城市间展开一段色彩鲜艳的生存战斗。,1,非常不推荐,核心是动作砍杀和二次元卖点，不符合你的偏好。,https://www.gamer520.com/82001.html,
2026-06-01,PC,堕落之主,类魂；动作RPG；黑暗奇幻；战斗；探索,在黑暗奇幻世界中穿越生死两界的庞大战役，用高强度战斗和策略击败堕落之神。,1,非常不推荐,核心是类魂高强度战斗和操作挑战，与你明确不喜欢的元素高度重合。,https://www.gamer520.com/66068.html,
2026-06-01,PC,装机模拟器2,模拟；装机；电脑维修；经营,经营电脑维修店，通过组装、维修和升级电脑完成客户订单并扩展业务。,1,不推荐,核心是模拟器流程操作，缺少人物、叙事和策略取舍。,https://www.gamer520.com/43259.html,
2026-06-01,PC,喵斯快跑 MUSE DASH,音乐；节奏；跑酷；二次元,跟随音乐节拍击打音符，在跑酷式的轨道上完成节奏挑战。,1,非常不推荐,核心是节奏反应操作挑战，不符合你的偏好。,https://www.gamer520.com/42489.html,
2026-06-01,PC,翼星求生 Icarus,开放世界；生存；建造；探索；合作,在外星星球上采集资源、建造基地、抵御环境威胁并完成勘探任务以求生存。,2,不推荐,有生存管理和探索，但偏重建造和长线生存循环，叙事牵引较弱。,https://www.gamer520.com/25485.html,
2026-05-31,PC,赏金乱斗：头号通缉,动作射击；俯视角；多人合作；拉索；PVP,扮演星际赏金猎人在随机关卡中追捕罪犯，用拉索穿越战场并击杀敌人，最终与队友争夺唯一赏金。,1,非常不推荐,核心是快节奏动作射击和多人对抗，与你明确不喜欢的元素高度重合。,https://www.gamer520.com/114554.html,
2026-05-31,PC,巫毒垂钓 Voodoo Fishin',钓鱼；合作；诡异氛围；沼泽；生存,与朋友一起深入诡异沼泽垂钓，打造木偶钓手寻找稀有鱼类，在越来越诡异的环境中努力活着带回渔获。,2,不推荐,诡异沼泽氛围有辨识度，但核心是联机钓鱼和生存，且需要合作游玩。,https://www.gamer520.com/114550.html,
2026-05-31,PC,007：初露锋芒 007 First Light,间谍；动作冒险；潜行；电影化叙事；起源故事,扮演军情六处新兵詹姆斯·邦德，在风景壮阔的地点执行任务、驾驶经典载具，揭露叛逆特工背后的深层阴谋。,3,可试,有电影化叙事和间谍氛围，但核心玩法仍是动作潜行和射击，操作要求较高。,https://www.gamer520.com/114287.html,
2026-05-31,PC,帝国幻想乡 TOHOTOPIA,4X；回合策略；东方Project；战争；城市建设,领导幻想乡少女组成的帝国在快节奏4X对局中探索、扩张、建设城市并征服对手，制霸幻想乡。,2,不推荐,世界观有特色但核心是4X回合策略战争，且带有明显二次元卖点，不符合你的偏好。,https://www.gamer520.com/113734.html,
2026-05-31,PC,黄金河计划 The Gold River Project,开放世界；生存；露营；探索；建造；实验,受邀参加偏远露营之旅却被遗弃，发现自己被困在一场残酷实验中，必须在荒野中搜寻资源、搭建营地并解开谜团以求生还。,3,可试,荒野生存、资源管理和实验悬疑有一定吸引力；但偏重生存建造，叙事密度可能有限。,https://www.gamer520.com/113344.html,
2026-05-31,PC/Switch,兔兔秘密花园2,恋爱冒险；视觉小说；休闲；互动；店员,"因职场失误陷入迷茫的主人公来到""兔兔秘密花园""，与店员互动交流，在休闲氛围中度过治愈夜晚。",1,非常不推荐,主要卖点是恋爱互动和二次元角色，与你明确不喜欢的元素重合。,https://www.gamer520.com/113240.html,
2026-05-31,PC,农庄牌,卡牌构筑；农场；轻度Rogue；植物；经营,在农场播种培育植物，用卡牌构筑和稻草人被动打出组合效果，同时管理税金与应对自然灾害。,2,不推荐,农场题材有生活气息，但核心是卡牌构筑和轻度Rogue循环，属于你通常不优先的方向。,https://www.gamer520.com/112684.html,
2026-05-31,PC,岚：外传,忍者；回合制战斗；像素美术；冲刺斩击；策略动作,"扮演忍者""岚""接受委托前往日本，在融合冲刺斩击的回合制战斗中击败敌人、夺回被盗的东方遗物。",2,不推荐,有忍者故事线但核心是回合制战斗，正好属于你通常兴趣较低的类型。,https://www.gamer520.com/96148.html,
2026-05-31,PC,像素人生 To Pixelia,生活模拟；开放世界；像素；职业选择；城市生活,在像素风格的点点市中开始新生活，自定义角色、选择职业、购买房产，自由决定成为什么样的人。,3,可试,生活模拟和职业选择有一定生活气息和开放度；但可能缺乏叙事核心，偏向自由模拟器。,https://www.gamer520.com/92282.html,
2026-05-30,Switch,布鲁伊寻找金笔 Bluey's Quest For The Gold Pen,儿童；冒险；探索；解谜；手绘；故事驱动,与布鲁伊一家在九个手绘世界中探索、解谜、乘船骑行，帮助找回被抢走的金笔。,2,不推荐,有故事驱动和探索，但针对儿童受众，内容较浅且缺乏策略纵深。,https://www.gamer520.com/114575.html,
2026-05-30,Switch,流明物语：特雷的回忆 LumenTale Memories,怪物收集；RPG；回合制战斗；冒险；记忆；宠物对战,"扮演特雷在美丽世界踏上冒险之旅，捕捉名为""阿尼莫""的生物并与之战斗，逐渐找回遗失的记忆。",2,不推荐,有故事和收集元素，但核心是回合制怪物对战和收集循环。,https://www.gamer520.com/114571.html,
2026-05-30,PC/Switch,挖掘者米娜 Mina the Hollower,动作冒险；平台跳跃；像素；鞭击；探索；地下世界,扮演挖掘者米娜用鞭子和钻头在地下穿梭战斗，探索黑暗世界并拯救被诅咒的岛屿。,2,不推荐,动作冒险和平台跳跃为核心，玩法偏操作挑战。,https://www.gamer520.com/114538.html,
2026-05-30,PC,冰点之下,FMV；末日生存；寒潮；丧尸；骰子选择；关系,寒潮和丧尸将世界推入末日，一名仓库管理员与三名同伴踏上极寒旅途，在骰子和选择中面对希望与阴谋。,3,可试,有末日旅途、骰子选择和生存压力；但真人影像与角色卖点可能压过更扎实的叙事。,https://www.gamer520.com/114533.html,
2026-05-30,PC,战娘自走棋,自走棋；自动战斗；卡牌；羁绊；角色收集；类Rogue,收集并升级不同战娘，通过阵容摆放、羁绊组合和圣物效果完成一轮轮自动战斗。,1,非常不推荐,核心是自动战斗、角色收集和羁绊数值，且卖点偏二次元角色，不符合你的偏好。,https://www.gamer520.com/114531.html,
2026-05-30,PC,纺织者之咏 Voice of Belldona,牌组构筑；类Rogue；回合制战斗；随机地图；角色养成；多结局,选择不同角色探索随机生成的奇幻地图，通过牌组、资源、养成和回合战斗推进一段多结局冒险。,2,不推荐,有探索和多结局，但玩法重点仍是传统卡牌构筑与回合战斗，较难形成你的兴趣。,https://www.gamer520.com/113922.html,
2026-05-30,PC,极限竞速：地平线6,开放世界竞速；日本；东京；公路旅行；汽车收藏；多人,驾驶数百辆汽车探索东京、郊区、码头和工业区，在日本的道路与汽车文化中参加比赛、收集车辆并建设自己的地产。,2,不推荐,日本道路、东京和旅行感有一定吸引力，但玩法核心仍是竞速驾驶和车辆收集。,https://www.gamer520.com/113322.html,
2026-05-30,PC,星火燎原 SPARK IGNITES,2.5D像素；中世纪；朝圣旅途；伙伴命运；分支选择；回合战术,在王国倾颓、古神滋生的世界中与伙伴踏上朝圣之旅，通过关键抉择和策略战斗决定彼此与世界的归宿。,3,可试,视觉气质、旅途和伙伴抉择值得留意；但传统回合制战斗占比可能较高。,https://www.gamer520.com/112453.html,
2026-05-30,PC,识质存在 PRAGMATA,科幻动作冒险；月球设施；双角色协作；入侵解谜；AI失控,调查员休与机器人女孩戴安娜被困在失控 AI 掌管的月球设施中，需要同时使用射击、移动和入侵能力寻找返回地球的方法。,4,推荐,月球设施、搭档关系和双角色混合玩法有明确体验核心；但动作和操作比重可能偏高。,https://www.gamer520.com/111820.html,
2026-05-30,PC,异变金属 Morbid Metal,动作肉鸽；高速砍杀；连击；角色切换；机器军团；Boss战,在快节奏轻肉鸽战斗中实时切换角色，用高速连击撕裂一波波机器军团并挑战首领。,1,非常不推荐,几乎完全以高速砍杀、连击和重复战斗为核心，与你明确不喜欢的元素高度重合。,https://www.gamer520.com/111563.html,
2026-05-30,Switch,链杖 ChainStaff,动作平台；战斗；手绘美术；外星；摇滚,使用可变形的链杖在外星孢子感染的地球上战斗，营救战友并击败变异怪物。,1,非常不推荐,核心是高强度动作平台跳跃和战斗，与你的口味完全错位。,https://www.gamer520.com/111550.html,
2026-05-30,PC,死亡搁浅2：冥滩之上,旅途冒险；末日世界；递送；探索；连接；资源管理；叙事,山姆和伙伴们穿越异界敌人横行的末日世界，完成一段关于递送、连接与人类存续的新旅程。,5,优先推荐,旅途、探索、具体任务、资源管理、人物关系和主题氛围都高度符合你的口味。,https://www.gamer520.com/110514.html,
2026-05-30,Switch,异形战机：战略 I･II 宇宙 R-TYPE TACTICS I･II COSMOS,回合策略；横向卷轴；射击；战术；科幻,体验R-Type系列的战术回合制与横向卷轴射击融合玩法，指挥部队在多条战役线中战斗。,1,非常不推荐,主要是战术回合战斗和横版射击，与你的口味明显错位。,https://www.gamer520.com/110227.html,
2026-05-30,PC,华夏史诗：战国,战国沙盒；开放世界；势力经营；门客；军队；城池；贸易,从乱世中的普通人起步，招揽门客、训练军队、经营城池和商道，也可以独自游历九州并选择自己的争霸路线。,3,研究可看,势力、贸易、队伍和城池系统有研究价值；但大沙盒、战斗和成长内容可能过重。,https://www.gamer520.com/109979.html,
2026-05-30,PC,杀戮尖塔2,Roguelike；卡牌构筑；爬塔；遗物；策略战斗,在不断变化的高塔中组建卡组、收集遗物和药水，用每一轮构筑应对不同敌人与随机挑战。,2,不推荐,完成度和策略性可能很强，但核心仍是传统 Rogue 卡牌战斗，正好属于你通常缺乏兴趣的方向。,https://www.gamer520.com/109811.html,
2026-05-30,PC,卡牌修仙传,修仙；卡牌管理；探索；法宝；炼丹；种植；成长,扮演失忆修仙者，用卡牌和工作台修炼心法、制作法宝、种植灵药并探索秘境，逐步拼回过往记忆。,2,不推荐,卡牌管理和记忆线有一点形式感，但核心仍是泛修仙成长、材料和战斗循环。,https://www.gamer520.com/109807.html,
2026-05-30,PC,剑星,后末日；动作冒险；砍杀；类魂；Boss战；角色养成,伊芙回到被怪物占据的地球，在文明遗迹中追查世界衰败的真相，并通过高速连招和 Boss 战收复失地。,1,非常不推荐,世界和画面可能有吸引力，但核心乐趣是高速动作、连招和高强度战斗，与你的口味明显错位。,https://www.gamer520.com/109449.html,
